,quantity,name,manaCost,cmc,colors,colorIdentity,type,types,subtypes,rarity,set,setName,text,flavor,artist,number,power,toughness,layout,multiverseid,imageUrl,rulings,foreignNames,printings,originalText,originalType,legalities,id,Deck,watermark,releaseDate,source,supertypes
Star of Extinction,1,Star of Extinction,{5}{R}{R},7,['Red'],['R'],Sorcery,['Sorcery'],,Mythic Rare,XLN,Ixalan,Destroy target land. Star of Extinction deals 20 damage to each creature and each planeswalker.,"""The visions haunt me. I see the end of the world, brought on by the search for the Immortal Sun.""
—Shaper Pashona",Chris Rahn,161,,,normal,435315.0,http://gatherer.wizards.com/Handlers/Image.ashx?multiverseid=435315&type=card,,"[{'name': 'Meteor der Auslöschung', 'imageUrl': 'http://gatherer.wizards.com/Handlers/Image.ashx?multiverseid=435614&type=card', 'language': 'German', 'multiverseid': 435614}, {'name': ""Étoile d'extinction"", 'imageUrl': 'http://gatherer.wizards.com/Handlers/Image.ashx?multiverseid=435913&type=card', 'language': 'French', 'multiverseid': 435913}, {'name': ""Stella dell'Estinzione"", 'imageUrl': 'http://gatherer.wizards.com/Handlers/Image.ashx?multiverseid=436212&type=card', 'language': 'Italian', 'multiverseid': 436212}, {'name': '絶滅の星', 'imageUrl': 'http://gatherer.wizards.com/Handlers/Image.ashx?multiverseid=436511&type=card', 'language': 'Japanese', 'multiverseid': 436511}, {'name': '멸종의 별', 'imageUrl': 'http://gatherer.wizards.com/Handlers/Image.ashx?multiverseid=436810&type=card', 'language': 'Korean', 'multiverseid': 436810}, {'name': 'Estrela da Extinção', 'imageUrl': 'http://gatherer.wizards.com/Handlers/Image.ashx?multiverseid=437109&type=card', 'language': 'Portuguese (Brazil)', 'multiverseid': 437109}, {'name': 'Звезда Вымирания', 'imageUrl': 'http://gatherer.wizards.com/Handlers/Image.ashx?multiverseid=437408&type=card', 'language': 'Russian', 'multiverseid': 437408}, {'name': 'Meteorito exterminador', 'imageUrl': 'http://gatherer.wizards.com/Handlers/Image.ashx?multiverseid=437707&type=card', 'language': 'Spanish', 'multiverseid': 437707}, {'name': '灭绝星落', 'imageUrl': 'http://gatherer.wizards.com/Handlers/Image.ashx?multiverseid=438006&type=card', 'language': 'Chinese Simplified', 'multiverseid': 438006}, {'name': '滅絕星落', 'imageUrl': 'http://gatherer.wizards.com/Handlers/Image.ashx?multiverseid=438305&type=card', 'language': 'Chinese Traditional', 'multiverseid': 438305}]",['XLN'],Destroy target land. Star of Extinction deals 20 damage to each creature and each planeswalker.,Sorcery,"[{'format': 'Brawl', 'legality': 'Legal'}, {'format': 'Commander', 'legality': 'Legal'}, {'format': 'Legacy', 'legality': 'Legal'}, {'format': 'Modern', 'legality': 'Legal'}, {'format': 'Standard', 'legality': 'Legal'}, {'format': 'Vintage', 'legality': 'Legal'}]",0bf5be3c08f897715ce47b4889dab633ff24a3f0,Izzet Drakes,,,,
Steam Vents,4,Steam Vents,,0,,"['U', 'R']",Land — Island Mountain,['Land'],"['Island', 'Mountain']",Mythic Rare,EXP,Zendikar Expeditions,"({T}: Add {U} or {R}.)
As Steam Vents enters the battlefield, you may pay 2 life. If you don't, Steam Vents enters the battlefield tapped.",,Noah Bradley,12,,,normal,405109.0,http://gatherer.wizards.com/Handlers/Image.ashx?multiverseid=405109&type=card,"[{'date': '2005-10-01', 'text': ""Has basic land types, but isn't a basic land. Things that affect basic lands don't affect it. For example, you can't find it with Civic Wayfinder.""}, {'date': '2005-10-01', 'text': ""If another effect (such as Loxodon Gatekeeper's ability) tells you to put lands onto the battlefield tapped, it enters the battlefield tapped whether you pay 2 life or not.""}, {'date': '2005-10-01', 'text': 'If multiple permanents with ""as enters the battlefield"" effects are entering the battlefield at the same time, process those effects one at a time, then put the permanents onto the battlefield all at once. For example, if you\'re at 3 life and an effect puts two of these onto the battlefield, you can pay 2 life for only one of them, not both.'}]",,"['GPT', 'RTR', 'EXP']","As Steam Vents enters the battlefield, you may pay 2 life. If you don't, Steam Vents enters the battlefield tapped.",Land — Island Mountain,"[{'format': 'Commander', 'legality': 'Legal'}, {'format': 'Legacy', 'legality': 'Legal'}, {'format': 'Modern', 'legality': 'Legal'}, {'format': 'Vintage', 'legality': 'Legal'}]",ed8f569d8df8864c440ac4c68402e0f4b1bda2c3,Izzet Drakes,,,,
Sulfur Falls,4,Sulfur Falls,,0,,"['U', 'R']",Land,['Land'],,Rare,ISD,Innistrad,"Sulfur Falls enters the battlefield tapped unless you control an Island or a Mountain.
{T}: Add {U} or {R}.",Skirsdag cultists meet behind a waterfall's curtain and plot with demonic forces.,Cliff Childs,248,,,normal,241987.0,http://gatherer.wizards.com/Handlers/Image.ashx?multiverseid=241987&type=card,,"[{'name': '硫磺瀑布', 'imageUrl': 'http://gatherer.wizards.com/Handlers/Image.ashx?multiverseid=272219&type=card', 'language': 'Chinese Simplified', 'multiverseid': 272219}, {'name': '硫磺瀑布', 'imageUrl': 'http://gatherer.wizards.com/Handlers/Image.ashx?multiverseid=272503&type=card', 'language': 'Chinese Traditional', 'multiverseid': 272503}, {'name': 'Cascata de Enxofre', 'imageUrl': 'http://gatherer.wizards.com/Handlers/Image.ashx?multiverseid=272787&type=card', 'language': 'Portuguese (Brazil)', 'multiverseid': 272787}, {'name': 'Chutes de soufre', 'imageUrl': 'http://gatherer.wizards.com/Handlers/Image.ashx?multiverseid=273071&type=card', 'language': 'French', 'multiverseid': 273071}, {'name': 'Серный Водопад', 'imageUrl': 'http://gatherer.wizards.com/Handlers/Image.ashx?multiverseid=273355&type=card', 'language': 'Russian', 'multiverseid': 273355}, {'name': 'Schwefelfälle', 'imageUrl': 'http://gatherer.wizards.com/Handlers/Image.ashx?multiverseid=273639&type=card', 'language': 'German', 'multiverseid': 273639}, {'name': 'Cascada de azufre', 'imageUrl': 'http://gatherer.wizards.com/Handlers/Image.ashx?multiverseid=273923&type=card', 'language': 'Spanish', 'multiverseid': 273923}, {'name': 'Cascata Sulfurea', 'imageUrl': 'http://gatherer.wizards.com/Handlers/Image.ashx?multiverseid=274207&type=card', 'language': 'Italian', 'multiverseid': 274207}, {'name': '硫黄の滝', 'imageUrl': 'http://gatherer.wizards.com/Handlers/Image.ashx?multiverseid=274491&type=card', 'language': 'Japanese', 'multiverseid': 274491}]","['ISD', 'DOM']","Sulfur Falls enters the battlefield tapped unless you control an Island or a Mountain.
{T}: Add {U} or {R} to your mana pool.",Land,"[{'format': 'Brawl', 'legality': 'Legal'}, {'format': 'Commander', 'legality': 'Legal'}, {'format': 'Legacy', 'legality': 'Legal'}, {'format': 'Modern', 'legality': 'Legal'}, {'format': 'Vintage', 'legality': 'Legal'}]",578640c35971b9a1c67d5b72fd5697ca51fc65f9,Izzet Drakes,,,,
The Mirari Conjecture,1,The Mirari Conjecture,{4}{U},5,['Blue'],['U'],Enchantment — Saga,['Enchantment'],['Saga'],Rare,DOM,Dominaria,"(As this Saga enters and after your draw step, add a lore counter. Sacrifice after III.)
I — Return target instant card from your graveyard to your hand.
II — Return target sorcery card from your graveyard to your hand.
III — Until end of turn, whenever you cast an instant or sorcery spell, copy it. You may choose new targets for the copy.",,James Arnold,57,,,normal,442945.0,http://gatherer.wizards.com/Handlers/Image.ashx?multiverseid=442945&type=card,"[{'date': '2018-04-27', 'text': ""The Mirari Conjecture's final chapter ability copies any instant or sorcery spell you cast, not just those with targets.""}, {'date': '2018-04-27', 'text': 'The copy is created on the stack, so it\'s not ""cast."" Abilities that trigger when a player casts a spell won\'t trigger.'}, {'date': '2018-04-27', 'text': ""The copy will have the same targets as the spell it's copying unless you choose new ones. You may change any number of the targets, including all of them or none of them. If, for one of the targets, you can't choose a new legal target, then it remains unchanged (even if the current target is illegal).""}, {'date': '2018-04-27', 'text': 'If the spell that\'s copied is modal (that is, it says ""Choose one —"" or the like), the copy will have the same mode. A different mode can\'t be chosen.'}, {'date': '2018-04-27', 'text': ""If the spell that's copied has an X whose value was determined as it was cast (like Jaya's Immolating Inferno does), the copy will have the same value of X.""}, {'date': '2018-04-27', 'text': ""If the spell has damage divided as it was cast (like Fight with Fire does when kicked), the division can't be changed (although the targets receiving that damage still can).""}, {'date': '2018-04-27', 'text': ""The controller of a copy can't choose to pay any alternative or additional costs for the copy. However, effects based on any alternative or additional costs that were paid for the original spell are copied as though those same costs were paid for the copy.""}, {'date': '2018-04-27', 'text': ""As a Saga enters the battlefield, its controller puts a lore counter on it. As your precombat main phase begins (immediately after your draw step), you put another lore counter on each Saga you control. Putting a lore counter on a Saga in either of these ways doesn't use the stack.""}, {'date': '2018-04-27', 'text': ""Each symbol on the left of a Saga's text box represents a chapter ability. A chapter ability is a triggered ability that triggers when a lore counter that is put on the Saga causes the number of lore counters on the Saga to become equal to or greater than the ability's chapter number. Chapter abilities are put onto the stack and may be responded to.""}, {'date': '2018-04-27', 'text': ""A chapter ability doesn't trigger if a lore counter is put on a Saga that already had a number of lore counters greater than or equal to that chapter's number. For example, the third lore counter put on a Saga causes the III chapter ability to trigger, but I and II won't trigger again.""}, {'date': '2018-04-27', 'text': ""Once a chapter ability has triggered, the ability on the stack won't be affected if the Saga gains or loses counters, or if it leaves the battlefield.""}, {'date': '2018-04-27', 'text': 'If multiple chapter abilities trigger at the same time, their controller puts them on the stack in any order. If any of them require targets, those targets are chosen as you put the abilities on the stack, before any of those abilities resolve.'}, {'date': '2018-04-27', 'text': ""If counters are removed from a Saga, the appropriate chapter abilities will trigger again when the Saga receives lore counters. Removing lore counters won't cause a previous chapter ability to trigger.""}, {'date': '2018-04-27', 'text': ""Once the number of lore counters on a Saga is greater than or equal to the greatest number among its chapter abilities—in the Dominaria set, this is always three—the Saga's controller sacrifices it as soon as its chapter ability has left the stack, most likely by resolving or being countered. This state-based action doesn't use the stack.""}]","[{'name': 'Die Mirari-Hypothese', 'imageUrl': 'http://gatherer.wizards.com/Handlers/Image.ashx?multiverseid=443214&type=card', 'language': 'German', 'multiverseid': 443214}, {'name': 'La conjetura del Mirari', 'imageUrl': 'http://gatherer.wizards.com/Handlers/Image.ashx?multiverseid=443483&type=card', 'language': 'Spanish', 'multiverseid': 443483}, {'name': 'La conjecture du Mirari', 'imageUrl': 'http://gatherer.wizards.com/Handlers/Image.ashx?multiverseid=443752&type=card', 'language': 'French', 'multiverseid': 443752}, {'name': 'Congettura sul Mirari', 'imageUrl': 'http://gatherer.wizards.com/Handlers/Image.ashx?multiverseid=444021&type=card', 'language': 'Italian', 'multiverseid': 444021}, {'name': 'ミラーリ予想', 'imageUrl': 'http://gatherer.wizards.com/Handlers/Image.ashx?multiverseid=444290&type=card', 'language': 'Japanese', 'multiverseid': 444290}, {'name': '미라리의 예측', 'imageUrl': 'http://gatherer.wizards.com/Handlers/Image.ashx?multiverseid=444559&type=card', 'language': 'Korean', 'multiverseid': 444559}, {'name': 'A Conjectura do Mirari', 'imageUrl': 'http://gatherer.wizards.com/Handlers/Image.ashx?multiverseid=444828&type=card', 'language': 'Portuguese (Brazil)', 'multiverseid': 444828}, {'name': 'Гипотеза о Мирари', 'imageUrl': 'http://gatherer.wizards.com/Handlers/Image.ashx?multiverseid=445097&type=card', 'language': 'Russian', 'multiverseid': 445097}, {'name': '映奇宝珠探究', 'imageUrl': 'http://gatherer.wizards.com/Handlers/Image.ashx?multiverseid=445366&type=card', 'language': 'Chinese Simplified', 'multiverseid': 445366}, {'name': '映奇寶珠探究', 'imageUrl': 'http://gatherer.wizards.com/Handlers/Image.ashx?multiverseid=445635&type=card', 'language': 'Chinese Traditional', 'multiverseid': 445635}]",['DOM'],"(As this Saga enters and after your draw step, add a lore counter. Sacrifice after III.)
I — Return target instant card from your graveyard to your hand.
II — Return target sorcery card from your graveyard to your hand.
III — Until end of turn, whenever you cast an instant or sorcery spell, copy it. You may choose new targets for the copy.",Enchantment — Saga,"[{'format': 'Brawl', 'legality': 'Legal'}, {'format': 'Commander', 'legality': 'Legal'}, {'format': 'Legacy', 'legality': 'Legal'}, {'format': 'Modern', 'legality': 'Legal'}, {'format': 'Vintage', 'legality': 'Legal'}]",af9e5467286158430f8341ad9a6fcfb770a5dc44,Izzet Drakes,,,,
Tormenting Voice,4,Tormenting Voice,{1}{R},2,['Red'],['R'],Sorcery,['Sorcery'],,Common,IMA,Iconic Masters,"As an additional cost to cast this spell, discard a card.
Draw two cards.","""Unwelcome thoughts crowd my mind. Are they my own madness, or the whispers of another?""
—Sarkhan Vol",Volkan Baga,150,,,normal,438716.0,http://gatherer.wizards.com/Handlers/Image.ashx?multiverseid=438716&type=card,"[{'date': '2018-07-13', 'text': ""You must discard exactly one card to cast Tormenting Voice; you can't cast it without discarding a card, and you can't discard additional cards.""}]","[{'name': '苦しめる声', 'imageUrl': 'http://gatherer.wizards.com/Handlers/Image.ashx?multiverseid=438965&type=card', 'language': 'Japanese', 'multiverseid': 438965}, {'name': '折磨幽声', 'imageUrl': 'http://gatherer.wizards.com/Handlers/Image.ashx?multiverseid=439214&type=card', 'language': 'Chinese Simplified', 'multiverseid': 439214}]","['KTK', 'DTK', 'SOI', 'CN2', 'AKH', 'IMA', 'M19']","As an additional cost to cast Tormenting Voice, discard a card.
Draw two cards.",Sorcery,"[{'format': 'Brawl', 'legality': 'Legal'}, {'format': 'Commander', 'legality': 'Legal'}, {'format': 'Legacy', 'legality': 'Legal'}, {'format': 'Modern', 'legality': 'Legal'}, {'format': 'Standard', 'legality': 'Legal'}, {'format': 'Vintage', 'legality': 'Legal'}]",b509efaa38fb8a4ac0d1454c38057d4535f68f29,Izzet Drakes,,,,
